{
  "execution_id": "sbx_s1_detonation_b2c3d4e5f6a1",
  "request_id": "req_detonate_1234567890",
  "tenant_id": "tenant-enterprise-cyber",
  "actor": {
    "type": "agent",
    "id": "spiffe://cybrik.io/agent/malware-analyzer",
    "tenant_id": "tenant-enterprise-cyber"
  },
  "purpose": "dynamic_analysis",
  "sandbox_tier": "S1",
  "command": ["/usr/local/bin/detonate", "--timeout", "60", "/samples/suspicious.elf"],
  "code_payload": {
    "runtime": "binary_elf",
    "code": "BASE64_ELF_PAYLOAD_STUB",
    "entrypoint": "suspicious.elf",
    "dependencies": []
  },
  "resource_limits": {
    "cpu_cores": 2.0,
    "memory_mb": 2048,
    "wall_clock_timeout_seconds": 120,
    "max_output_bytes": 1048576,
    "max_disk_mb": 1024,
    "max_processes": 64
  },
  "decompression_bomb_guard": {
    "max_ratio": 100.0,
    "max_uncompressed_bytes": 104857600,
    "max_file_count": 500,
    "max_recursion_depth": 5,
    "block_nested_archives": true
  },
  "network_egress": {
    "policy": "monitored",
    "allowed_destinations": ["127.0.0.1", "10.200.0.0/16"],
    "dns_servers": ["10.200.0.2"]
  },
  "input_artifacts": [
    {
      "artifact_id": "art_sample_001",
      "name": "suspicious.elf",
      "path": "/samples/suspicious.elf",
      "size_bytes": 65536,
      "digest": "sha256:1111111111111111111111111111111111111111111111111111111111111111",
      "media_type": "application/x-executable",
      "data_marking": {
        "classification": "confidential",
        "tlp": "TLP:AMBER",
        "handling": ["malware-sample", "no-export"]
      },
      "storage_locator": "s3://cybrik-malware-vault/tenant-enterprise-cyber/suspicious.elf"
    }
  ],
  "output_artifacts": [
    {
      "artifact_id": "art_pcap_001",
      "name": "network_trace.pcap",
      "path": "/reports/network_trace.pcap",
      "size_bytes": 20480,
      "digest": "sha256:2222222222222222222222222222222222222222222222222222222222222222",
      "media_type": "application/vnd.tcpdump.pcap",
      "data_marking": {
        "classification": "confidential",
        "tlp": "TLP:AMBER",
        "handling": ["network-telemetry"]
      },
      "storage_locator": "s3://cybrik-artifacts/tenant-enterprise-cyber/network_trace.pcap"
    }
  ],
  "execution_receipt": {
    "receipt_id": "rcpt_sbx_002",
    "execution_id": "sbx_s1_detonation_b2c3d4e5f6a1",
    "tenant_id": "tenant-enterprise-cyber",
    "status": "completed",
    "exit_code": 0,
    "resource_usage": {
      "cpu_time_ms": 1450,
      "peak_memory_mb": 512,
      "wall_clock_duration_ms": 62000,
      "output_bytes": 8192
    },
    "stdout_digest": "sha256:3333333333333333333333333333333333333333333333333333333333333333",
    "stderr_digest": "sha256:4444444444444444444444444444444444444444444444444444444444444444",
    "started_at": "2026-09-04T20:10:00Z",
    "finished_at": "2026-09-04T20:11:02Z",
    "receipt_digest": "sha256:5555555555555555555555555555555555555555555555555555555555555555",
    "signature": "sig_ed25519_sample_signature_002"
  },
  "artifact_manifests": [
    {
      "artifact_id": "art_sample_001",
      "name": "suspicious.elf",
      "path": "/samples/suspicious.elf",
      "size_bytes": 65536,
      "digest": "sha256:1111111111111111111111111111111111111111111111111111111111111111",
      "media_type": "application/x-executable",
      "data_marking": {
        "classification": "confidential",
        "tlp": "TLP:AMBER",
        "handling": ["malware-sample", "no-export"]
      },
      "storage_locator": "s3://cybrik-malware-vault/tenant-enterprise-cyber/suspicious.elf"
    },
    {
      "artifact_id": "art_pcap_001",
      "name": "network_trace.pcap",
      "path": "/reports/network_trace.pcap",
      "size_bytes": 20480,
      "digest": "sha256:2222222222222222222222222222222222222222222222222222222222222222",
      "media_type": "application/vnd.tcpdump.pcap",
      "data_marking": {
        "classification": "confidential",
        "tlp": "TLP:AMBER",
        "handling": ["network-telemetry"]
      },
      "storage_locator": "s3://cybrik-artifacts/tenant-enterprise-cyber/network_trace.pcap"
    }
  ],
  "data_marking": {
    "classification": "confidential",
    "tlp": "TLP:AMBER",
    "handling": ["malware-analysis"]
  },
  "created_at": "2026-09-04T20:10:00Z",
  "digest": "sha256:6666666666666666666666666666666666666666666666666666666666666666"
}
